{
  "algorithmParamsHash": "sha256:403ab74765e26afd5ea4348194478c99718a49334d6fe95a9f4d998515499c24",
  "layoutInputsFingerprint": "sha256:c757d667911a747ce9e38ea46fb7686e0ea01355f176a74b1b1849604d19fe38",
  "layoutVersion": "wonder-the-gene-1.0.0",
  "membersFingerprint": "sha256:c757d667911a747ce9e38ea46fb7686e0ea01355f176a74b1b1849604d19fe38",
  "nodes": {
    "crispr_concept": {
      "lock": "hard",
      "role": "spine",
      "step": 6,
      "x": 340,
      "y": 83.76
    },
    "dna_concept": {
      "lock": "hard",
      "role": "spine",
      "step": 2,
      "x": -340,
      "y": -83.76
    },
    "epigenetics_concept": {
      "lock": "hard",
      "role": "spine",
      "step": 5,
      "x": 170,
      "y": 54.76
    },
    "gene_expression_concept": {
      "lock": "hard",
      "role": "spine",
      "step": 3,
      "x": -170,
      "y": -54.76
    },
    "natural_selection_concept": {
      "lock": "hard",
      "role": "spine",
      "step": 1,
      "x": -510,
      "y": -73.37
    },
    "protein_structure_concept": {
      "lock": "hard",
      "role": "spine",
      "step": 4,
      "x": 0,
      "y": 0
    },
    "synthetic_biology_concept": {
      "lock": "hard",
      "role": "spine",
      "step": 7,
      "x": 510,
      "y": 73.37
    }
  },
  "rendererContractVersion": "2.0.0",
  "schemaVersion": "1.0.0",
  "solverVersion": "wonder-spine-1.0.0",
  "toolchain": {
    "d3Version": "7.9.0",
    "nodeMajor": 24
  },
  "wonderId": "the-gene"
}
