{
  "algorithmParamsHash": "sha256:403ab74765e26afd5ea4348194478c99718a49334d6fe95a9f4d998515499c24",
  "layoutInputsFingerprint": "sha256:e80e893def27f6de074554a6e709626ab1821e1cd9316ee5f63c06dd362b4682",
  "layoutVersion": "wonder-edge-ai-1.0.0",
  "membersFingerprint": "sha256:e80e893def27f6de074554a6e709626ab1821e1cd9316ee5f63c06dd362b4682",
  "nodes": {
    "computer_vision_concept": {
      "lock": "hard",
      "role": "spine",
      "step": 4,
      "x": 0,
      "y": 0
    },
    "control_theory_concept": {
      "lock": "hard",
      "role": "spine",
      "step": 6,
      "x": 340,
      "y": 83.76
    },
    "edge_computing_concept": {
      "lock": "hard",
      "role": "spine",
      "step": 1,
      "x": -510,
      "y": -73.37
    },
    "edge_model_compression": {
      "lock": "hard",
      "role": "spine",
      "step": 3,
      "x": -170,
      "y": -54.76
    },
    "machine_learning_concept": {
      "lock": "hard",
      "role": "spine",
      "step": 2,
      "x": -340,
      "y": -83.76
    },
    "robotics_concept": {
      "lock": "hard",
      "role": "spine",
      "step": 7,
      "x": 510,
      "y": 73.37
    },
    "signal_processing_concept": {
      "lock": "hard",
      "role": "spine",
      "step": 5,
      "x": 170,
      "y": 54.76
    }
  },
  "rendererContractVersion": "2.0.0",
  "schemaVersion": "1.0.0",
  "solverVersion": "wonder-spine-1.0.0",
  "toolchain": {
    "d3Version": "7.9.0",
    "nodeMajor": 24
  },
  "wonderId": "edge-ai"
}
