{
  "algorithmParamsHash": "sha256:403ab74765e26afd5ea4348194478c99718a49334d6fe95a9f4d998515499c24",
  "layoutInputsFingerprint": "sha256:6436b5e760f07b4f34eaf3a296f92874bad6a8cb49b2feb7eafb5aa5091e31ea",
  "layoutVersion": "wonder-networks-1.0.0",
  "membersFingerprint": "sha256:6436b5e760f07b4f34eaf3a296f92874bad6a8cb49b2feb7eafb5aa5091e31ea",
  "nodes": {
    "complex_systems_concept": {
      "lock": "hard",
      "role": "spine",
      "step": 6,
      "x": 425,
      "y": 83.64
    },
    "epidemiological_modeling_concept": {
      "lock": "hard",
      "role": "spine",
      "step": 5,
      "x": 255,
      "y": 73.73
    },
    "graph_theory_concept": {
      "lock": "hard",
      "role": "spine",
      "step": 1,
      "x": -425,
      "y": -83.64
    },
    "network_effects_concept": {
      "lock": "hard",
      "role": "spine",
      "step": 4,
      "x": 85,
      "y": 29.15
    },
    "network_theory_concept": {
      "lock": "hard",
      "role": "spine",
      "step": 2,
      "x": -255,
      "y": -73.73
    },
    "social_network_theory_concept": {
      "lock": "hard",
      "role": "spine",
      "step": 3,
      "x": -85,
      "y": -29.15
    }
  },
  "rendererContractVersion": "2.0.0",
  "schemaVersion": "1.0.0",
  "solverVersion": "wonder-spine-1.0.0",
  "toolchain": {
    "d3Version": "7.9.0",
    "nodeMajor": 24
  },
  "wonderId": "networks"
}
