{
  "algorithmParamsHash": "sha256:403ab74765e26afd5ea4348194478c99718a49334d6fe95a9f4d998515499c24",
  "layoutInputsFingerprint": "sha256:5e5f39442da963f0a3908943bbfd602214511960493bac93b346df0a80455882",
  "layoutVersion": "wonder-markets-1.0.0",
  "membersFingerprint": "sha256:5e5f39442da963f0a3908943bbfd602214511960493bac93b346df0a80455882",
  "nodes": {
    "adam_smith_person": {
      "lock": "hard",
      "role": "spine",
      "step": 2,
      "x": -255,
      "y": -73.73
    },
    "behavioral_economics_concept": {
      "lock": "hard",
      "role": "spine",
      "step": 4,
      "x": 85,
      "y": 29.15
    },
    "cognitive_bias_concept": {
      "lock": "hard",
      "role": "spine",
      "step": 5,
      "x": 255,
      "y": 73.73
    },
    "game_theory_concept": {
      "lock": "hard",
      "role": "spine",
      "step": 3,
      "x": -85,
      "y": -29.15
    },
    "information_asymmetry_concept": {
      "lock": "hard",
      "role": "spine",
      "step": 6,
      "x": 425,
      "y": 83.64
    },
    "supply_and_demand_concept": {
      "lock": "hard",
      "role": "spine",
      "step": 1,
      "x": -425,
      "y": -83.64
    }
  },
  "rendererContractVersion": "2.0.0",
  "schemaVersion": "1.0.0",
  "solverVersion": "wonder-spine-1.0.0",
  "toolchain": {
    "d3Version": "7.9.0",
    "nodeMajor": 24
  },
  "wonderId": "markets"
}
