{
  "algorithmParamsHash": "sha256:403ab74765e26afd5ea4348194478c99718a49334d6fe95a9f4d998515499c24",
  "layoutInputsFingerprint": "sha256:1ff159736459f92e37deb347223e7945b1b1f5a00a8ac77012d427a2aad43f5e",
  "layoutVersion": "wonder-the-mind-1.0.0",
  "membersFingerprint": "sha256:1ff159736459f92e37deb347223e7945b1b1f5a00a8ac77012d427a2aad43f5e",
  "nodes": {
    "consciousness_concept": {
      "lock": "hard",
      "role": "spine",
      "step": 4,
      "x": 85,
      "y": 29.15
    },
    "free_will_concept": {
      "lock": "hard",
      "role": "spine",
      "step": 6,
      "x": 425,
      "y": 83.64
    },
    "neuroplasticity_concept": {
      "lock": "hard",
      "role": "spine",
      "step": 3,
      "x": -85,
      "y": -29.15
    },
    "neurotransmission_concept": {
      "lock": "hard",
      "role": "spine",
      "step": 2,
      "x": -255,
      "y": -73.73
    },
    "philosophy_of_mind_concept": {
      "lock": "hard",
      "role": "spine",
      "step": 5,
      "x": 255,
      "y": 73.73
    },
    "sensory_systems_concept": {
      "lock": "hard",
      "role": "spine",
      "step": 1,
      "x": -425,
      "y": -83.64
    }
  },
  "rendererContractVersion": "2.0.0",
  "schemaVersion": "1.0.0",
  "solverVersion": "wonder-spine-1.0.0",
  "toolchain": {
    "d3Version": "7.9.0",
    "nodeMajor": 24
  },
  "wonderId": "the-mind"
}
