{
  "algorithmParamsHash": "sha256:403ab74765e26afd5ea4348194478c99718a49334d6fe95a9f4d998515499c24",
  "layoutInputsFingerprint": "sha256:364b1a2d762a84aeafb40b9748f3390c91c1c0c4b7fd69b02d59fd780d6913cd",
  "layoutVersion": "wonder-germs-1.0.0",
  "membersFingerprint": "sha256:364b1a2d762a84aeafb40b9748f3390c91c1c0c4b7fd69b02d59fd780d6913cd",
  "nodes": {
    "antibiotic_resistance_concept": {
      "lock": "hard",
      "role": "spine",
      "step": 6,
      "x": 340,
      "y": 83.76
    },
    "epidemiology_concept": {
      "lock": "hard",
      "role": "spine",
      "step": 7,
      "x": 510,
      "y": 73.37
    },
    "germ_theory_concept": {
      "lock": "hard",
      "role": "spine",
      "step": 2,
      "x": -340,
      "y": -83.76
    },
    "immune_system_concept": {
      "lock": "hard",
      "role": "spine",
      "step": 4,
      "x": 0,
      "y": 0
    },
    "infectious_disease_concept": {
      "lock": "hard",
      "role": "spine",
      "step": 1,
      "x": -510,
      "y": -73.37
    },
    "louis_pasteur_person": {
      "lock": "hard",
      "role": "spine",
      "step": 3,
      "x": -170,
      "y": -54.76
    },
    "vaccination_science_concept": {
      "lock": "hard",
      "role": "spine",
      "step": 5,
      "x": 170,
      "y": 54.76
    }
  },
  "rendererContractVersion": "2.0.0",
  "schemaVersion": "1.0.0",
  "solverVersion": "wonder-spine-1.0.0",
  "toolchain": {
    "d3Version": "7.9.0",
    "nodeMajor": 24
  },
  "wonderId": "germs"
}
