{
  "algorithmParamsHash": "sha256:403ab74765e26afd5ea4348194478c99718a49334d6fe95a9f4d998515499c24",
  "layoutInputsFingerprint": "sha256:9e6ba6ea21d5e3904248b600f57f304d45b91b862d7e4376a3dceb0afb476720",
  "layoutVersion": "wonder-music-1.0.0",
  "membersFingerprint": "sha256:9e6ba6ea21d5e3904248b600f57f304d45b91b862d7e4376a3dceb0afb476720",
  "nodes": {
    "acoustics_concept": {
      "lock": "hard",
      "role": "spine",
      "step": 1,
      "x": -425,
      "y": -83.64
    },
    "harmony_concept": {
      "lock": "hard",
      "role": "spine",
      "step": 2,
      "x": -255,
      "y": -73.73
    },
    "johann_sebastian_bach_person": {
      "lock": "hard",
      "role": "spine",
      "step": 4,
      "x": 85,
      "y": 29.15
    },
    "mathematical_music_concept": {
      "lock": "hard",
      "role": "spine",
      "step": 3,
      "x": -85,
      "y": -29.15
    },
    "music_cognition_concept": {
      "lock": "hard",
      "role": "spine",
      "step": 5,
      "x": 255,
      "y": 73.73
    },
    "neuroaesthetics_concept": {
      "lock": "hard",
      "role": "spine",
      "step": 6,
      "x": 425,
      "y": 83.64
    }
  },
  "rendererContractVersion": "2.0.0",
  "schemaVersion": "1.0.0",
  "solverVersion": "wonder-spine-1.0.0",
  "toolchain": {
    "d3Version": "7.9.0",
    "nodeMajor": 24
  },
  "wonderId": "music"
}
